{"$schema":"https://json-schema.org/draft/2020-12/schema","$id":"https://glaciereq.dev/schemas/casebrain-execution-delta-v1.json","title":"CASEBRAIN Execution-First Architecture Delta","type":"object","additionalProperties":false,"required":["schema_version","thread_anchor","run_id","generated_at","authority","dispatch","connector_attempts","synchronization","partial_failures","completed_delta","completion"],"properties":{"schema_version":{"const":"1.0.0"},"thread_anchor":{"const":"MEMORY_ARCHITECTURE__CASEBUILDER_4000__APEX_MEMORY_NEXUS__PR_51"},"run_id":{"type":"string","minLength":8,"maxLength":128},"generated_at":{"type":"string","format":"date-time"},"authority":{"type":"object","additionalProperties":false,"required":["action_class","authorized","authority_source","system_side_executable_remaining"],"properties":{"action_class":{"enum":["internal_reversible","external_reversible","external_irreversible"]},"authorized":{"type":"boolean"},"authority_source":{"type":"string","minLength":1},"system_side_executable_remaining":{"type":"boolean"}}},"dispatch":{"type":"object","additionalProperties":false,"required":["protocol_ref","operation","affected_systems","raw_source_bytes_requested"],"properties":{"protocol_ref":{"const":"BRAIN/CONNECTORS/EXECUTION_FIRST_OPERATING_PROTOCOL.md"},"operation":{"type":"string","minLength":1},"affected_systems":{"type":"array","minItems":1,"uniqueItems":true,"items":{"enum":["github","supabase","notion","linear","clickup","jira","cloud_drive","casebrain","smithery","cloudflare"]}},"raw_source_bytes_requested":{"const":false}}},"connector_attempts":{"type":"array","minItems":1,"items":{"$ref":"#/$defs/connector"}},"synchronization":{"$ref":"#/$defs/sync"},"partial_failures":{"type":"array","items":{"$ref":"#/$defs/failure"}},"completed_delta":{"type":"object","additionalProperties":false,"required":["artifacts","mutations","verifications","open_gaps"],"properties":{"artifacts":{"type":"array","minItems":1,"items":{"type":"string","minLength":1}},"mutations":{"type":"array","items":{"type":"string","minLength":1}},"verifications":{"type":"array","minItems":1,"items":{"type":"string","minLength":1}},"open_gaps":{"type":"array","items":{"type":"string","minLength":1}}}},"completion":{"type":"object","additionalProperties":false,"required":["completion_state","receipt","operator_action_required","next_executable_step"],"properties":{"completion_state":{"enum":["completed","partial_completed","blocked_exact"]},"receipt":{"$ref":"#/$defs/receipt"},"operator_action_required":{"type":"boolean"},"next_executable_step":{"type":["string","null"]}}}},"$defs":{"quality":{"type":"object","additionalProperties":false,"required":["score","status","evidence_refs"],"properties":{"score":{"type":"number","minimum":0,"maximum":100},"status":{"enum":["unknown","unmeasured","partially_measured","measured"]},"evidence_refs":{"type":"array","items":{"type":"string","minLength":1}}}},"connector":{"type":"object","additionalProperties":false,"required":["connector_key","registry_state","tool_available","authentication_state","authentication_inferred_from_availability","approved_roots","sensitivity_ceiling","mode","probe","provenance","idempotency","connector_quality","data_quality","next_human_gate"],"properties":{"connector_key":{"type":"string","minLength":1},"registry_state":{"enum":["advertised","connected","blocked","staging_only","projection_only","excluded","unknown"]},"tool_available":{"type":"boolean"},"authentication_state":{"enum":["authenticated","auth_required","blocked","unknown"]},"authentication_inferred_from_availability":{"const":false},"approved_roots":{"type":"array","items":{"type":"string","minLength":1}},"sensitivity_ceiling":{"enum":["public","internal","confidential","restricted","sealed"]},"mode":{"enum":["read_only","metadata_only","task_projection","canonical_write","audited_rls_write","blocked"]},"probe":{"type":"object","additionalProperties":false,"required":["attempted","success","last_successful_probe_at","freshness_status","receipt_ref","error_state"],"properties":{"attempted":{"type":"boolean"},"success":{"type":"boolean"},"last_successful_probe_at":{"type":["string","null"]},"freshness_status":{"enum":["fresh","stale","expired","unknown"]},"receipt_ref":{"type":["string","null"]},"error_state":{"type":"object","additionalProperties":false,"required":["status","code"],"properties":{"status":{"enum":["none","partial","failed","blocked","unknown"]},"code":{"type":["string","null"]}}}}},"provenance":{"type":"object","additionalProperties":false,"required":["source_linked","source_ref","byte_persistence","protected_identifiers_persisted"],"properties":{"source_linked":{"type":"boolean"},"source_ref":{"type":["string","null"]},"byte_persistence":{"enum":["none","metadata_only","approved_original_bytes"]},"protected_identifiers_persisted":{"const":false}}},"idempotency":{"type":"object","additionalProperties":false,"required":["strategy","key_ref","replay_safe"],"properties":{"strategy":{"type":"string","minLength":1},"key_ref":{"type":["string","null"]},"replay_safe":{"type":"boolean"}}},"connector_quality":{"$ref":"#/$defs/quality"},"data_quality":{"$ref":"#/$defs/quality"},"next_human_gate":{"type":["string","null"]}}},"sync":{"type":"object","additionalProperties":false,"required":["authority_order","systems","conflict_policy","receipt_policy"],"properties":{"authority_order":{"const":["approved_original_bytes","github_canonical","supabase_durable_state","notion_projection","task_receipts"]},"systems":{"type":"object","additionalProperties":false,"required":["github","supabase","notion","task_systems","cloud_drives"],"properties":{"github":{"const":"schemas_validators_migrations_decisions"},"supabase":{"const":"audited_rls_registry_runtime_ledger_projection"},"notion":{"const":"human_control_plane_projection_no_privileged_bytes"},"task_systems":{"const":"tasks_approvals_blockers_receipt_pointers_only"},"cloud_drives":{"const":"approved_original_bytes_only"}}},"conflict_policy":{"const":"higher_authority_wins_lower_projection_marked_stale"},"receipt_policy":{"const":"append_only_hash_or_stable_id_linked"}}},"failure":{"type":"object","additionalProperties":false,"required":["connector_key","slice","error_code","dependent_state","unaffected_work_continued","receipt_ref"],"properties":{"connector_key":{"type":"string","minLength":1},"slice":{"type":"string","minLength":1},"error_code":{"type":"string","minLength":1},"dependent_state":{"enum":["stale","unverified","blocked"]},"unaffected_work_continued":{"const":true},"receipt_ref":{"type":"string","minLength":1}}},"receipt":{"type":"object","additionalProperties":false,"required":["work_item","action_class","authority_source","operation_performed","result","evidence_reference","verified_at","remaining_blocker","next_executable_step","operator_action_required"],"properties":{"work_item":{"type":"string","minLength":1},"action_class":{"type":"string","minLength":1},"authority_source":{"type":"string","minLength":1},"operation_performed":{"type":"string","minLength":1},"result":{"enum":["success","partial_success","blocked"]},"evidence_reference":{"type":"string","minLength":1},"verified_at":{"type":"string","format":"date-time"},"remaining_blocker":{"type":["string","null"]},"next_executable_step":{"type":["string","null"]},"operator_action_required":{"type":"boolean"}}}}}
