{"schema_version":"1.0.0","thread_anchor":"MEMORY_ARCHITECTURE__CASEBUILDER_4000__APEX_MEMORY_NEXUS__PR_51","run_id":"memory-architecture-2026-08-02-hst-02","generated_at":"2026-08-03T05:32:00Z","authority":{"action_class":"internal_reversible","authorized":true,"authority_source":"binding_execution_first_operator_directive","system_side_executable_remaining":true},"dispatch":{"protocol_ref":"BRAIN/CONNECTORS/EXECUTION_FIRST_OPERATING_PROTOCOL.md","operation":"audit and harden the CASEBRAIN connector fabric, execution protocol, provenance boundary, and synchronization architecture","affected_systems":["github","supabase","notion","linear","casebrain"],"raw_source_bytes_requested":false},"connector_attempts":[{"connector_key":"github","registry_state":"connected","tool_available":true,"authentication_state":"authenticated","authentication_inferred_from_availability":false,"approved_roots":["GlacierEQ/AEON-777","GlacierEQ/SUPERLUMINAL_CASE_MATRIX","GlacierEQ/public-actions-runner-host"],"sensitivity_ceiling":"internal","mode":"canonical_write","probe":{"attempted":true,"success":true,"last_successful_probe_at":"2026-08-03T05:31:00Z","freshness_status":"fresh","receipt_ref":"github:pr-watch:2026-08-03T05:31Z","error_state":{"status":"partial","code":"actions_zero_step_log_blob_missing"}},"provenance":{"source_linked":true,"source_ref":"github:GlacierEQ/AEON-777@main","byte_persistence":"metadata_only","protected_identifiers_persisted":false},"idempotency":{"strategy":"branch_path_blob_sha_and_expected_head","key_ref":"casebrain-execution-delta-2026-08-02","replay_safe":true},"connector_quality":{"score":0,"status":"unmeasured","evidence_refs":[]},"data_quality":{"score":0,"status":"unmeasured","evidence_refs":[]},"next_human_gate":null},{"connector_key":"supabase_backend_ops","registry_state":"connected","tool_available":true,"authentication_state":"authenticated","authentication_inferred_from_availability":false,"approved_roots":[],"sensitivity_ceiling":"restricted","mode":"audited_rls_write","probe":{"attempted":true,"success":true,"last_successful_probe_at":"2026-08-03T05:30:00Z","freshness_status":"fresh","receipt_ref":"supabase:dyhprklicgewmrimecey:control-plane-snapshot:2026-08-03T05:30Z","error_state":{"status":"none","code":null}},"provenance":{"source_linked":true,"source_ref":"supabase:dyhprklicgewmrimecey","byte_persistence":"metadata_only","protected_identifiers_persisted":false},"idempotency":{"strategy":"database_constraints_atomic_rpc_and_deterministic_keys","key_ref":"enqueue_connector_execution_job_v3","replay_safe":true},"connector_quality":{"score":0,"status":"unmeasured","evidence_refs":[]},"data_quality":{"score":0,"status":"unmeasured","evidence_refs":[]},"next_human_gate":"approve one exact metadata-only root and accountable owner"},{"connector_key":"notion","registry_state":"connected","tool_available":true,"authentication_state":"authenticated","authentication_inferred_from_availability":false,"approved_roots":[],"sensitivity_ceiling":"internal","mode":"metadata_only","probe":{"attempted":true,"success":true,"last_successful_probe_at":"2026-08-03T05:31:00Z","freshness_status":"fresh","receipt_ref":"notion:355b1e4f322381deb8a6f783a875df5b:readback","error_state":{"status":"none","code":null}},"provenance":{"source_linked":true,"source_ref":"github:GlacierEQ/AEON-777@main","byte_persistence":"metadata_only","protected_identifiers_persisted":false},"idempotency":{"strategy":"projection_key_source_hash_and_version","key_ref":"connector_projection_state_v3","replay_safe":true},"connector_quality":{"score":0,"status":"unmeasured","evidence_refs":[]},"data_quality":{"score":0,"status":"unmeasured","evidence_refs":[]},"next_human_gate":"approve exact page or data-source root before broader projection"},{"connector_key":"linear","registry_state":"connected","tool_available":true,"authentication_state":"authenticated","authentication_inferred_from_availability":false,"approved_roots":["project:AKOS Massive Connector Control Plane"],"sensitivity_ceiling":"internal","mode":"task_projection","probe":{"attempted":true,"success":true,"last_successful_probe_at":"2026-08-03T05:29:00Z","freshness_status":"fresh","receipt_ref":"linear:HI-45,HI-46:readback","error_state":{"status":"none","code":null}},"provenance":{"source_linked":true,"source_ref":"github-and-supabase-receipt-pointers","byte_persistence":"metadata_only","protected_identifiers_persisted":false},"idempotency":{"strategy":"issue_identifier_plus_receipt_digest","key_ref":"HI-46","replay_safe":true},"connector_quality":{"score":0,"status":"unmeasured","evidence_refs":[]},"data_quality":{"score":0,"status":"unmeasured","evidence_refs":[]},"next_human_gate":null},{"connector_key":"casebrain","registry_state":"connected","tool_available":true,"authentication_state":"authenticated","authentication_inferred_from_availability":false,"approved_roots":[],"sensitivity_ceiling":"restricted","mode":"blocked","probe":{"attempted":true,"success":false,"last_successful_probe_at":"2026-08-03T05:28:00Z","freshness_status":"unknown","receipt_ref":"casebrain:whoAmI:authenticated","error_state":{"status":"partial","code":"project_and_recall_actions_tool_not_found"}},"provenance":{"source_linked":false,"source_ref":null,"byte_persistence":"none","protected_identifiers_persisted":false},"idempotency":{"strategy":"unknown_until_recall_route_is_restored","key_ref":null,"replay_safe":false},"connector_quality":{"score":0,"status":"unknown","evidence_refs":[]},"data_quality":{"score":0,"status":"unknown","evidence_refs":[]},"next_human_gate":"repair CASEBRAIN action routing before memory promotion"}],"synchronization":{"authority_order":["approved_original_bytes","github_canonical","supabase_durable_state","notion_projection","task_receipts"],"systems":{"github":"schemas_validators_migrations_decisions","supabase":"audited_rls_registry_runtime_ledger_projection","notion":"human_control_plane_projection_no_privileged_bytes","task_systems":"tasks_approvals_blockers_receipt_pointers_only","cloud_drives":"approved_original_bytes_only"},"conflict_policy":"higher_authority_wins_lower_projection_marked_stale","receipt_policy":"append_only_hash_or_stable_id_linked"},"partial_failures":[{"connector_key":"casebrain","slice":"project enumeration and memory recall","error_code":"tool_not_found","dependent_state":"unverified","unaffected_work_continued":true,"receipt_ref":"casebrain:2026-08-03T05:28Z"},{"connector_key":"github","slice":"private repository Actions validation logs","error_code":"zero_step_blob_not_found","dependent_state":"stale","unaffected_work_continued":true,"receipt_ref":"github-actions:SUPERLUMINAL_CASE_MATRIX:30420765584"}],"completed_delta":{"artifacts":["BRAIN/CONNECTORS/CASEBRAIN_EXECUTION_DELTA_SCHEMA.json","BRAIN/CONNECTORS/receipts/CASEBRAIN_EXECUTION_DELTA_2026-08-02.json","BRAIN/CONNECTORS/validate_casebrain_execution_delta.mjs","BRAIN/CONNECTORS/SUPABASE_GITHUB_NOTION_TASK_SYNC_ARCHITECTURE.md","BRAIN/CONNECTORS/MEMORY_ARCHITECTURE_DELTA_2026-08-02_CONTROL_PACKET.md"],"mutations":["requested bounded rerun of failed GitHub Actions jobs for SUPERLUMINAL_CASE_MATRIX PR 71","integrated the new validator into the canonical connector package test chain"],"verifications":["Supabase snapshot: 20 registry rows, 52 routes, 46 enabled, 0 unsafe enabled mutations","Supabase runtime: 47 closed, 5 open, 0 half-open, 0 enabled-open circuits","Supabase execution: 1 succeeded job, 1 partial job, 2 ledger rows, 0 ambiguous reservations","Notion control plane and CASEBRAIN worker hub read back successfully","Linear HI-45, HI-46, and HI-46 child packets read back successfully"],"open_gaps":["Cloudflare Queue delivery, acknowledgement, and DLQ behavior remain unverified","all 20 registry rows still lack approved roots and accountable owners","17 connector authentication and freshness states remain unknown","the sole verified projection is expired even though its Notion sync status is recorded as synced","CASEBRAIN recall and project enumeration routes are misrouted"]},"completion":{"completion_state":"partial_completed","receipt":{"work_item":"CaseBuilder 4000 / Apex Memory Nexus append-only architecture delta","action_class":"internal_reversible","authority_source":"binding_execution_first_operator_directive","operation_performed":"live audit, bounded remediation, machine-readable control packet, validator, synchronization architecture, and append-only delta","result":"partial_success","evidence_reference":"github:GlacierEQ/AEON-777:casebrain-execution-delta-2026-08-02","verified_at":"2026-08-03T05:32:00Z","remaining_blocker":"external Queue transport and CASEBRAIN recall routing remain unverified","next_executable_step":"run hosted validation, merge when green, then append receipt pointers to Notion and Linear","operator_action_required":false},"operator_action_required":false,"next_executable_step":"run hosted validation, merge when green, then append receipt pointers to Notion and Linear"}}
